{"$id":"https://pyamplicol.dev/schema/report-cache-v4.json","$schema":"https://json-schema.org/draft/2020-12/schema","additionalProperties":false,"properties":{"$schema":{"const":"./report-cache.schema.json"},"dataset_id":{"minLength":1,"type":"string"},"entries":{"items":{"additionalProperties":false,"properties":{"cell_id":{"minLength":1,"type":"string"},"measurement":{"additionalProperties":false,"allOf":[{"if":{"properties":{"status":{"const":"ok"}},"required":["status"]},"then":{"properties":{"validation":{"properties":{"direct_agreements":{"items":{"additionalProperties":false,"properties":{"abi":{"const":"pyamplicol-report-direct-agreement-v1"},"absolute_difference":{"minimum":0,"type":"number"},"absolute_tolerance":{"minimum":0,"type":"number"},"baseline":{"type":"number"},"baseline_cell_id":{"minLength":1,"type":"string"},"candidate":{"type":"number"},"candidate_cell_id":{"minLength":1,"type":"string"},"edge_kind":{"enum":["builtin-ufo-recurrence","z-recurrence-cross-mode","lc-cross-layout-component","lc-legacy-pyamplicol-component"]},"relative_difference":{"minimum":0,"type":"number"},"relative_tolerance":{"minimum":0,"type":"number"},"status":{"enum":["not_available","ok","failed","timeout","memory_limit","skip","validation_failed","error","unsupported"]},"value_kind":{"enum":["matrix_element","lc_common_component"]}},"required":["abi","edge_kind","value_kind","baseline_cell_id","candidate_cell_id","status","candidate","baseline","absolute_difference","relative_difference","relative_tolerance","absolute_tolerance"],"type":"object"},"type":"array"},"lc_common_component":{"additionalProperties":false,"properties":{"abi":{"const":"pyamplicol-report-lc-common-component-v1"},"cell_id":{"minLength":1,"type":"string"},"color_flow_ids":{"items":{"minLength":1,"type":"string"},"minItems":1,"type":"array","uniqueItems":true},"helicity_ids":{"items":{"minLength":1,"type":"string"},"minItems":1,"type":"array","uniqueItems":true},"point_digest":{"pattern":"^[0-9a-f]{64}$","type":"string"},"value":{"type":"number"}},"required":["abi","cell_id","value","point_digest","helicity_ids","color_flow_ids"],"type":"object"}},"required":["direct_agreements"],"type":"object"}}}}],"properties":{"artifact":{"type":["object","null"]},"execution_seconds_per_point":{"minimum":0,"type":["number","null"]},"failure":{"type":["object","null"]},"generation_seconds":{"minimum":0,"type":["number","null"]},"matrix_element":{"type":["number","string","null"]},"provenance":{"type":["object","null"]},"relative_standard_error":{"minimum":0,"type":["number","null"]},"resources":{"type":["object","null"]},"sample_count":{"minimum":1,"type":["integer","null"]},"selector_contract":{"type":["object","null"]},"standard_error_seconds_per_point":{"minimum":0,"type":["number","null"]},"status":{"enum":["not_available","ok","failed","timeout","memory_limit","skip","validation_failed","error","unsupported"]},"validation":{"oneOf":[{"type":"null"},{"properties":{"direct_agreements":{"items":{"additionalProperties":false,"properties":{"abi":{"const":"pyamplicol-report-direct-agreement-v1"},"absolute_difference":{"minimum":0,"type":"number"},"absolute_tolerance":{"minimum":0,"type":"number"},"baseline":{"type":"number"},"baseline_cell_id":{"minLength":1,"type":"string"},"candidate":{"type":"number"},"candidate_cell_id":{"minLength":1,"type":"string"},"edge_kind":{"enum":["builtin-ufo-recurrence","z-recurrence-cross-mode","lc-cross-layout-component","lc-legacy-pyamplicol-component"]},"relative_difference":{"minimum":0,"type":"number"},"relative_tolerance":{"minimum":0,"type":"number"},"status":{"enum":["not_available","ok","failed","timeout","memory_limit","skip","validation_failed","error","unsupported"]},"value_kind":{"enum":["matrix_element","lc_common_component"]}},"required":["abi","edge_kind","value_kind","baseline_cell_id","candidate_cell_id","status","candidate","baseline","absolute_difference","relative_difference","relative_tolerance","absolute_tolerance"],"type":"object"},"type":"array"},"lc_common_component":{"additionalProperties":false,"properties":{"abi":{"const":"pyamplicol-report-lc-common-component-v1"},"cell_id":{"minLength":1,"type":"string"},"color_flow_ids":{"items":{"minLength":1,"type":"string"},"minItems":1,"type":"array","uniqueItems":true},"helicity_ids":{"items":{"minLength":1,"type":"string"},"minItems":1,"type":"array","uniqueItems":true},"point_digest":{"pattern":"^[0-9a-f]{64}$","type":"string"},"value":{"type":"number"}},"required":["abi","cell_id","value","point_digest","helicity_ids","color_flow_ids"],"type":"object"}},"type":"object"}]},"wall_seconds_per_point":{"minimum":0,"type":["number","null"]}},"required":["status","generation_seconds","wall_seconds_per_point","execution_seconds_per_point","matrix_element","sample_count","standard_error_seconds_per_point","relative_standard_error","artifact","selector_contract","validation","resources","provenance","failure"],"type":"object"},"measurement_spec":{"type":"object"},"n_final":{"minimum":1,"type":"integer"},"process":{"minLength":1,"type":"string"},"process_key":{"type":["string","null"]},"variant":{"type":["string","null"]},"workload":{"enum":["selected-flow","all-flow","contracted"]}},"required":["cell_id","process_key","process","n_final","variant","workload","measurement_spec","measurement"],"type":"object"},"type":"array"},"kind":{"const":"performance_measurements"},"measurement_specs":{"items":{"type":"object"},"type":"array"},"report_version":{"const":"0.3.0"},"schema_version":{"const":4}},"required":["$schema","schema_version","report_version","kind","dataset_id","measurement_specs","entries"],"title":"pyAmpliCol three-mode performance cache","type":"object"}
