{"$schema":"./report-cache.schema.json","dataset_id":"scalar_contact","entries":[{"cell_id":"scalar-contact-n2-scalar-contact-contracted","measurement":{"artifact":null,"execution_seconds_per_point":null,"failure":null,"generation_seconds":null,"matrix_element":null,"provenance":null,"relative_standard_error":null,"resources":null,"sample_count":null,"selector_contract":null,"standard_error_seconds_per_point":null,"status":"not_available","validation":null,"wall_seconds_per_point":null},"measurement_spec":{"accuracy":"full","backend":"jit","execution_mode":"compiled","jit_optimization_level":3,"model":"scalar_contact"},"n_final":2,"process":"scalar_0 scalar_0 > scalar_0 scalar_0","process_key":"scalar_contact","variant":null,"workload":"contracted"},{"cell_id":"scalar-contact-n3-scalar-contact-contracted","measurement":{"artifact":null,"execution_seconds_per_point":null,"failure":null,"generation_seconds":null,"matrix_element":null,"provenance":null,"relative_standard_error":null,"resources":null,"sample_count":null,"selector_contract":null,"standard_error_seconds_per_point":null,"status":"not_available","validation":null,"wall_seconds_per_point":null},"measurement_spec":{"accuracy":"full","backend":"jit","execution_mode":"compiled","jit_optimization_level":3,"model":"scalar_contact"},"n_final":3,"process":"scalar_0 scalar_0 > scalar_0 scalar_0 scalar_0","process_key":"scalar_contact","variant":null,"workload":"contracted"},{"cell_id":"scalar-contact-n4-scalar-contact-contracted","measurement":{"artifact":null,"execution_seconds_per_point":null,"failure":null,"generation_seconds":null,"matrix_element":null,"provenance":null,"relative_standard_error":null,"resources":null,"sample_count":null,"selector_contract":null,"standard_error_seconds_per_point":null,"status":"not_available","validation":null,"wall_seconds_per_point":null},"measurement_spec":{"accuracy":"full","backend":"jit","execution_mode":"compiled","jit_optimization_level":3,"model":"scalar_contact"},"n_final":4,"process":"scalar_0 scalar_0 > scalar_0 scalar_0 scalar_0 scalar_0","process_key":"scalar_contact","variant":null,"workload":"contracted"},{"cell_id":"scalar-contact-n5-scalar-contact-contracted","measurement":{"artifact":null,"execution_seconds_per_point":null,"failure":null,"generation_seconds":null,"matrix_element":null,"provenance":null,"relative_standard_error":null,"resources":null,"sample_count":null,"selector_contract":null,"standard_error_seconds_per_point":null,"status":"not_available","validation":null,"wall_seconds_per_point":null},"measurement_spec":{"accuracy":"full","backend":"jit","execution_mode":"compiled","jit_optimization_level":3,"model":"scalar_contact"},"n_final":5,"process":"scalar_0 scalar_0 > scalar_0 scalar_0 scalar_0 scalar_0 scalar_0","process_key":"scalar_contact","variant":null,"workload":"contracted"},{"cell_id":"scalar-contact-n6-scalar-contact-contracted","measurement":{"artifact":null,"execution_seconds_per_point":null,"failure":null,"generation_seconds":null,"matrix_element":null,"provenance":null,"relative_standard_error":null,"resources":null,"sample_count":null,"selector_contract":null,"standard_error_seconds_per_point":null,"status":"not_available","validation":null,"wall_seconds_per_point":null},"measurement_spec":{"accuracy":"full","backend":"jit","execution_mode":"compiled","jit_optimization_level":3,"model":"scalar_contact"},"n_final":6,"process":"scalar_0 scalar_0 > scalar_0 scalar_0 scalar_0 scalar_0 scalar_0 scalar_0","process_key":"scalar_contact","variant":null,"workload":"contracted"},{"cell_id":"scalar-contact-n7-scalar-contact-contracted","measurement":{"artifact":null,"execution_seconds_per_point":null,"failure":null,"generation_seconds":null,"matrix_element":null,"provenance":null,"relative_standard_error":null,"resources":null,"sample_count":null,"selector_contract":null,"standard_error_seconds_per_point":null,"status":"not_available","validation":null,"wall_seconds_per_point":null},"measurement_spec":{"accuracy":"full","backend":"jit","execution_mode":"compiled","jit_optimization_level":3,"model":"scalar_contact"},"n_final":7,"process":"scalar_0 scalar_0 > scalar_0 scalar_0 scalar_0 scalar_0 scalar_0 scalar_0 scalar_0","process_key":"scalar_contact","variant":null,"workload":"contracted"},{"cell_id":"scalar-contact-n8-scalar-contact-contracted","measurement":{"artifact":null,"execution_seconds_per_point":null,"failure":null,"generation_seconds":null,"matrix_element":null,"provenance":null,"relative_standard_error":null,"resources":null,"sample_count":null,"selector_contract":null,"standard_error_seconds_per_point":null,"status":"not_available","validation":null,"wall_seconds_per_point":null},"measurement_spec":{"accuracy":"full","backend":"jit","execution_mode":"compiled","jit_optimization_level":3,"model":"scalar_contact"},"n_final":8,"process":"scalar_0 scalar_0 > scalar_0 scalar_0 scalar_0 scalar_0 scalar_0 scalar_0 scalar_0 scalar_0","process_key":"scalar_contact","variant":null,"workload":"contracted"}],"kind":"performance_measurements","measurement_specs":[{"accuracy":"full","backend":"jit","execution_mode":"compiled","jit_optimization_level":3,"model":"scalar_contact"}],"report_version":"0.3.0","schema_version":4}
